{
  "source": "source/video.mp4",
  "model": "ggml-medium",
  "language": "zh",
  "duration": 24.0,
  "generated_at": "2026-09-24T21:03:11+08:00",
  "segments": [
    {
      "id": 1,
      "start": 0.0,
      "end": 2.5,
      "text": "各位好",
      "conclusion": null,
      "checked_at": null
    },
    {
      "id": 2,
      "start": 2.5,
      "end": 6.0,
      "text": "今天用一个很短的小样例过一遍流程",
      "conclusion": null,
      "checked_at": null
    },
    {
      "id": 3,
      "start": 6.0,
      "end": 8.9,
      "text": "现在是讲解人画面这一段基本没变化",
      "conclusion": null,
      "checked_at": null
    },
    {
      "id": 4,
      "start": 8.9,
      "end": 11.5,
      "text": "好我们切到主图了",
      "conclusion": null,
      "checked_at": null
    },
    {
      "id": 5,
      "start": 11.5,
      "end": 14.2,
      "text": "现在看到的是派森列表的结构图",
      "conclusion": null,
      "checked_at": null
    },
    {
      "id": 6,
      "start": 14.2,
      "end": 16.5,
      "text": "注意这里的数据变化过程正在走完",
      "conclusion": null,
      "checked_at": null
    },
    {
      "id": 7,
      "start": 16.5,
      "end": 21.0,
      "text": "画面停住了大家可以把结论抄下来",
      "conclusion": null,
      "checked_at": null
    },
    {
      "id": 8,
      "start": 21.0,
      "end": 24.0,
      "text": "最后大家看屏幕上的总结页",
      "conclusion": null,
      "checked_at": null
    }
  ]
}
